{
  "schema_version": 1,
  "kind": "findings",
  "question": "Có nên dùng gRPC?",
  "summary": "Có",
  "findings": [
    {
      "id": "f-1",
      "statement": "đã dùng",
      "confidence": 0.9,
      "evidence": [
        {
          "type": "doc",
          "ref": "README"
        }
      ]
    }
  ]
}
